<?xml version="1.0" ?>
<!-- A palya formatumat leiro DTD fajl -->
<!DOCTYPE level SYSTEM "level.dtd">
<level>
    <nodes>
        <node type="node" name="node1">
            <position x="1" y="0"/>
            <neighbours>
                <neighbour name="node2"/>
            </neighbours>
        </node>
        <node type="node" name="node2">
            <position x="1" y="2"/>
            <neighbours>
                <neighbour name="node1"/>
            </neighbours>
        </node>
        <node type="node" name="node3">
            <position x="0" y="1"/>
            <neighbours>
                <neighbour name="node4"/>
            </neighbours>
        </node>
        <node type="node" name="node4">
            <position x="2" y="1"/>
            <neighbours>
                <neighbour name="node3"/>
            </neighbours>
        </node>
    </nodes>
    <trains>
        <train start_node="node1" start_time="0">
            <trainPart type="engine"/>
        </train>
        <train start_node="node3" start_time="0">
            <trainPart type="engine"/>
        </train>
    </trains>
</level>