<?xml version="1.0"?>
<!-- A palya formatumat leiro DTD fajl -->
<!DOCTYPE level SYSTEM "level.dtd">
<level>
    <nodes>
        <node type="node" name="n1">
            <position x="0" y="320"/>
            <neighbours>
                <neighbour name="sw1"/>
            </neighbours>
        </node>
		
        <node type="switch" name="sw1">
            <position x="80" y="300"/>
            <neighbours>
                <neighbour name="st1"/>
                <neighbour name="n2"/>
                <neighbour name="n1"/>
            </neighbours>
        </node>
		
		<node type="station" name="st1" color="green">
            <position x="120" y="250"/>
            <neighbours>
                <neighbour name="sw1"/>
				<neighbour name="sw2"/>
            </neighbours>
        </node>
		
		<node type="switch" name="sw2">
            <position x="190" y="220"/>
            <neighbours>
                <neighbour name="sw3"/>
                <neighbour name="st1"/>
                <neighbour name="n3"/>
            </neighbours>
        </node>
		
		<node type="switch" name="sw3">
            <position x="280" y="290"/>
            <neighbours>
                <neighbour name="sw2"/>
                <neighbour name="ls1"/>
                <neighbour name="sw4"/>
            </neighbours>
        </node>

		<node type="loaderStation" name="ls1" color="green">
            <position x="190" y="360"/>
            <neighbours>
                <neighbour name="sw3"/>
				<neighbour name="n2"/>
            </neighbours>
        </node>
		
        <node type="node" name="n2">
            <position x="170" y="420"/>
            <neighbours>
                <neighbour name="ls1"/>
				<neighbour name="sw1"/>
            </neighbours>
        </node>
		
		<node type="node" name="n3">
            <position x="210" y="170"/>
            <neighbours>
                <neighbour name="sw2"/>
				<neighbour name="n4"/>
            </neighbours>
        </node>
		
		<node type="node" name="n4">
            <position x="300" y="150"/>
            <neighbours>
                <neighbour name="n3"/>
				<neighbour name="n5"/>
            </neighbours>
        </node>
		
		<node type="node" name="n5">
            <position x="610" y="200"/>
            <neighbours>
                <neighbour name="n4"/>
				<neighbour name="sw5"/>
            </neighbours>
        </node>
		
		<node type="switch" name="sw4">
            <position x="400" y="300"/>
            <neighbours>
                <neighbour name="sp1"/>
                <neighbour name="ls2"/>
                <neighbour name="sw3"/>
            </neighbours>
        </node>
		
		<node type="loaderStation" name="ls2" color="blue">
            <position x="490" y="330"/>
            <neighbours>
                <neighbour name="sw4"/>
				<neighbour name="sw5"/>
            </neighbours>
        </node>
		
		<node type="switch" name="sw5">
            <position x="580" y="320"/>
            <neighbours>
                <neighbour name="ls2"/>
                <neighbour name="n5"/>
                <neighbour name="sw6"/>
            </neighbours>
        </node>
		
		<node type="specialPlace" name="sp1">
            <position x="500" y="130"/>
            <neighbours>
                <neighbour name="sw4"/>
            </neighbours>
        </node>
		
		<node type="switch" name="sw6">
            <position x="620" y="380"/>
            <neighbours>
                <neighbour name="st2"/>
                <neighbour name="sw5"/>
                <neighbour name="n6"/>
            </neighbours>
        </node>
		
		<node type="station" name="st2" color="red">
            <position x="580" y="450"/>
            <neighbours>
                <neighbour name="sw6"/>
				<neighbour name="st3"/>
            </neighbours>
        </node>
		
		<node type="station" name="st3" color="blue">
            <position x="420" y="450"/>
            <neighbours>
                <neighbour name="st2"/>
				<neighbour name="n7"/>
            </neighbours>
        </node>
		
		<node type="node" name="n7">
            <position x="320" y="430"/>
            <neighbours>
                <neighbour name="st3"/>
				<neighbour name="sp2"/>
            </neighbours>
        </node>
		
		<node type="specialPlace" name="sp2">
            <position x="310" y="350"/>
            <neighbours>
                <neighbour name="n7"/>
            </neighbours>
        </node>
		
		<node type="node" name="n6">
            <position x="800" y="500"/>
            <neighbours>
				<neighbour name="sw6"/>
            </neighbours>
        </node>
	</nodes>
	<trains>
	<train start_node="n6" start_time="200">
		<trainPart type="engine" speed="2"/>
		<trainPart type="cart" color="blue"/>
		<trainPart type="cart" color="red"/>
		<trainPart type="cart" color="blue"/>
	</train>
	<train start_node="n1" start_time="0">
		<trainPart type="engine" speed="2"/>
		<trainPart type="cart" color="green"/>
		<trainPart type="cart" color="red"/>
		<trainPart type="cart" color="red"/>
	</train>
</trains>
	
</level>

















