<?xml version="1.0"?>
<!-- A palya formatumat leiro DTD fajl -->
<!DOCTYPE level SYSTEM "level.dtd">
<level>
    <nodes>
        <node type="node" name="node1">
            <position x="20" y="20"/>
            <neighbours>
                <neighbour name="specialPlace1"/>
            </neighbours>
        </node>
        <node type="specialPlace" name="specialPlace1">
            <position x="80" y="20"/>
            <neighbours>
                <neighbour name="node1"/>
                <neighbour name="specialPlace2"/>
            </neighbours>
        </node>
        <node type="specialPlace" name="specialPlace2">
            <position x="160" y="20"/>
            <neighbours>
                <neighbour name="node2"/>
                <neighbour name="specialPlace1"/>
            </neighbours>
        </node>
        <node type="node" name="node2">
            <position x="240" y="20"/>
            <neighbours>
                <neighbour name="specialPlace2"/>
            </neighbours>
        </node>
    </nodes>
    <trains>
        <train start_node="node1" start_time="3">
            <trainPart type="engine" speed="1"/>
        </train>
    </trains>
</level>